{
  "$schema": "https://json-schema.org/draft/2020-12/schema",
  "type": "object",
  "required": [
    "status.disabled",
    "status.upToDate",
    "status.unsupportedOs",
    "status.missingDestination",
    "status.unavailable",
    "button.update",
    "button.updateAriaLabel",
    "button.prepare",
    "button.prepareAriaLabel",
    "button.comingSoon",
    "notice.storeDelay",
    "period.label",
    "period.range",
    "period.remaining.one",
    "period.remaining.two",
    "period.remaining.few",
    "period.remaining.many",
    "period.remaining.other",
    "period.startsIn.one",
    "period.startsIn.two",
    "period.startsIn.few",
    "period.startsIn.many",
    "period.startsIn.other",
    "period.ended",
    "os.requirement"
  ],
  "additionalProperties": false,
  "properties": {
    "status.disabled": {"type": "object", "required": ["en"], "additionalProperties": false, "properties": {"en": {"type": "string", "minLength": 1, "maxLength": 500}}, "patternProperties": {"^[A-Za-z]{2,8}(?:-[A-Za-z0-9]{1,8})*$": {"type": "string", "minLength": 1, "maxLength": 500}}},
    "status.upToDate": {"type": "object", "required": ["en"], "additionalProperties": false, "properties": {"en": {"type": "string", "minLength": 1, "maxLength": 500}}, "patternProperties": {"^[A-Za-z]{2,8}(?:-[A-Za-z0-9]{1,8})*$": {"type": "string", "minLength": 1, "maxLength": 500}}},
    "status.unsupportedOs": {"type": "object", "required": ["en"], "additionalProperties": false, "properties": {"en": {"type": "string", "minLength": 1, "maxLength": 500}}, "patternProperties": {"^[A-Za-z]{2,8}(?:-[A-Za-z0-9]{1,8})*$": {"type": "string", "minLength": 1, "maxLength": 500}}},
    "status.missingDestination": {"type": "object", "required": ["en"], "additionalProperties": false, "properties": {"en": {"type": "string", "minLength": 1, "maxLength": 500}}, "patternProperties": {"^[A-Za-z]{2,8}(?:-[A-Za-z0-9]{1,8})*$": {"type": "string", "minLength": 1, "maxLength": 500}}},
    "status.unavailable": {"type": "object", "required": ["en"], "additionalProperties": false, "properties": {"en": {"type": "string", "minLength": 1, "maxLength": 500}}, "patternProperties": {"^[A-Za-z]{2,8}(?:-[A-Za-z0-9]{1,8})*$": {"type": "string", "minLength": 1, "maxLength": 500}}},
    "button.update": {"type": "object", "required": ["en"], "additionalProperties": false, "properties": {"en": {"type": "string", "minLength": 1, "maxLength": 500}}, "patternProperties": {"^[A-Za-z]{2,8}(?:-[A-Za-z0-9]{1,8})*$": {"type": "string", "minLength": 1, "maxLength": 500}}},
    "button.updateAriaLabel": {"type": "object", "required": ["en"], "additionalProperties": false, "properties": {"en": {"type": "string", "minLength": 1, "maxLength": 500}}, "patternProperties": {"^[A-Za-z]{2,8}(?:-[A-Za-z0-9]{1,8})*$": {"type": "string", "minLength": 1, "maxLength": 500}}},
    "button.prepare": {"type": "object", "required": ["en"], "additionalProperties": false, "properties": {"en": {"type": "string", "minLength": 1, "maxLength": 500}}, "patternProperties": {"^[A-Za-z]{2,8}(?:-[A-Za-z0-9]{1,8})*$": {"type": "string", "minLength": 1, "maxLength": 500}}},
    "button.prepareAriaLabel": {"type": "object", "required": ["en"], "additionalProperties": false, "properties": {"en": {"type": "string", "minLength": 1, "maxLength": 500}}, "patternProperties": {"^[A-Za-z]{2,8}(?:-[A-Za-z0-9]{1,8})*$": {"type": "string", "minLength": 1, "maxLength": 500}}},
    "button.comingSoon": {"type": "object", "required": ["en"], "additionalProperties": false, "properties": {"en": {"type": "string", "minLength": 1, "maxLength": 500}}, "patternProperties": {"^[A-Za-z]{2,8}(?:-[A-Za-z0-9]{1,8})*$": {"type": "string", "minLength": 1, "maxLength": 500}}},
    "notice.storeDelay": {"type": "object", "required": ["en"], "additionalProperties": false, "properties": {"en": {"type": "string", "minLength": 1, "maxLength": 500}}, "patternProperties": {"^[A-Za-z]{2,8}(?:-[A-Za-z0-9]{1,8})*$": {"type": "string", "minLength": 1, "maxLength": 500}}},
    "period.label": {"type": "object", "required": ["en"], "additionalProperties": false, "properties": {"en": {"type": "string", "minLength": 1, "maxLength": 500}}, "patternProperties": {"^[A-Za-z]{2,8}(?:-[A-Za-z0-9]{1,8})*$": {"type": "string", "minLength": 1, "maxLength": 500}}},
    "period.range": {"type": "object", "required": ["en"], "additionalProperties": false, "properties": {"en": {"type": "string", "minLength": 1, "maxLength": 500}}, "patternProperties": {"^[A-Za-z]{2,8}(?:-[A-Za-z0-9]{1,8})*$": {"type": "string", "minLength": 1, "maxLength": 500}}},
    "period.remaining.one": {"type": "object", "required": ["en"], "additionalProperties": false, "properties": {"en": {"type": "string", "minLength": 1, "maxLength": 500}}, "patternProperties": {"^[A-Za-z]{2,8}(?:-[A-Za-z0-9]{1,8})*$": {"type": "string", "minLength": 1, "maxLength": 500}}},
    "period.remaining.two": {"type": "object", "required": ["en"], "additionalProperties": false, "properties": {"en": {"type": "string", "minLength": 1, "maxLength": 500}}, "patternProperties": {"^[A-Za-z]{2,8}(?:-[A-Za-z0-9]{1,8})*$": {"type": "string", "minLength": 1, "maxLength": 500}}},
    "period.remaining.few": {"type": "object", "required": ["en"], "additionalProperties": false, "properties": {"en": {"type": "string", "minLength": 1, "maxLength": 500}}, "patternProperties": {"^[A-Za-z]{2,8}(?:-[A-Za-z0-9]{1,8})*$": {"type": "string", "minLength": 1, "maxLength": 500}}},
    "period.remaining.many": {"type": "object", "required": ["en"], "additionalProperties": false, "properties": {"en": {"type": "string", "minLength": 1, "maxLength": 500}}, "patternProperties": {"^[A-Za-z]{2,8}(?:-[A-Za-z0-9]{1,8})*$": {"type": "string", "minLength": 1, "maxLength": 500}}},
    "period.remaining.other": {"type": "object", "required": ["en"], "additionalProperties": false, "properties": {"en": {"type": "string", "minLength": 1, "maxLength": 500}}, "patternProperties": {"^[A-Za-z]{2,8}(?:-[A-Za-z0-9]{1,8})*$": {"type": "string", "minLength": 1, "maxLength": 500}}},
    "period.startsIn.one": {"type": "object", "required": ["en"], "additionalProperties": false, "properties": {"en": {"type": "string", "minLength": 1, "maxLength": 500}}, "patternProperties": {"^[A-Za-z]{2,8}(?:-[A-Za-z0-9]{1,8})*$": {"type": "string", "minLength": 1, "maxLength": 500}}},
    "period.startsIn.two": {"type": "object", "required": ["en"], "additionalProperties": false, "properties": {"en": {"type": "string", "minLength": 1, "maxLength": 500}}, "patternProperties": {"^[A-Za-z]{2,8}(?:-[A-Za-z0-9]{1,8})*$": {"type": "string", "minLength": 1, "maxLength": 500}}},
    "period.startsIn.few": {"type": "object", "required": ["en"], "additionalProperties": false, "properties": {"en": {"type": "string", "minLength": 1, "maxLength": 500}}, "patternProperties": {"^[A-Za-z]{2,8}(?:-[A-Za-z0-9]{1,8})*$": {"type": "string", "minLength": 1, "maxLength": 500}}},
    "period.startsIn.many": {"type": "object", "required": ["en"], "additionalProperties": false, "properties": {"en": {"type": "string", "minLength": 1, "maxLength": 500}}, "patternProperties": {"^[A-Za-z]{2,8}(?:-[A-Za-z0-9]{1,8})*$": {"type": "string", "minLength": 1, "maxLength": 500}}},
    "period.startsIn.other": {"type": "object", "required": ["en"], "additionalProperties": false, "properties": {"en": {"type": "string", "minLength": 1, "maxLength": 500}}, "patternProperties": {"^[A-Za-z]{2,8}(?:-[A-Za-z0-9]{1,8})*$": {"type": "string", "minLength": 1, "maxLength": 500}}},
    "period.ended": {"type": "object", "required": ["en"], "additionalProperties": false, "properties": {"en": {"type": "string", "minLength": 1, "maxLength": 500}}, "patternProperties": {"^[A-Za-z]{2,8}(?:-[A-Za-z0-9]{1,8})*$": {"type": "string", "minLength": 1, "maxLength": 500}}},
    "os.requirement": {"type": "object", "required": ["en"], "additionalProperties": false, "properties": {"en": {"type": "string", "minLength": 1, "maxLength": 500}}, "patternProperties": {"^[A-Za-z]{2,8}(?:-[A-Za-z0-9]{1,8})*$": {"type": "string", "minLength": 1, "maxLength": 500}}}
  }
}
