{
    "status.disabled": {
        "en": "This update is currently unavailable.",
        "ar": "هذا التحديث غير متاح حاليًا.",
        "he": "עדכון זה אינו זמין כעת.",
        "ja": "このアップデートは現在利用できません。",
        "it": "Questo aggiornamento non è al momento disponibile.",
        "id": "Pembaruan ini saat ini tidak tersedia.",
        "uk": "Це оновлення наразі недоступне.",
        "nl": "Deze update is momenteel niet beschikbaar.",
        "ca": "Aquesta actualització no està disponible actualment.",
        "el": "Aυτή η ενημέρωση δεν είναι διαθέσιμη αυτήν τη στιγμή.",
        "sv": "Den här uppdateringen är inte tillgänglig för närvarande.",
        "es": "Esta actualización no está disponible en este momento.",
        "sk": "Táto aktualizácia je momentálne nedostupná.",
        "sl": "Ta posodobitev trenutno ni na voljo.",
        "th": "อัปเดตนี้ยังไม่พร้อมใช้งานในขณะนี้",
        "cs": "Tato aktualizace je momentálně nedostupná.",
        "da": "Denne opdatering er i øjeblikket ikke tilgængelig.",
        "de": "Dieses Update ist derzeit nicht verfügbar.",
        "tr": "Bu güncelleme şu anda mevcut değil.",
        "no": "Denne oppdateringen er for øyeblikket ikke tilgjengelig.",
        "hu": "Ez a frissítés jelenleg nem érhető el.",
        "hi": "यह अपडेट वर्तमान में उपलब्ध नहीं है।",
        "fi": "Tämä päivitys ei ole tällä hetkellä saatavilla.",
        "fr": "Cette mise à jour n'est pas disponible pour le moment.",
        "vi": "Bản cập nhật này hiện không khả dụng.",
        "pl": "Ta aktualizacja jest obecnie niedostępna.",
        "pt": "Esta atualização não está disponível no momento.",
        "ro": "Această actualizare nu este disponibilă momentan.",
        "ru": "Это обновление в настоящее время недоступно.",
        "ko": "현재 이 업데이트를 사용할 수 없습니다.",
        "zh-Hans": "当前无法使用此更新。",
        "zh-Hant": "目前無法使用此更新。"
    },
    "status.upToDate": {
        "en": "You're using the latest version.",
        "ar": "أنت تستخدم أحدث إصدار.",
        "he": "הגרסה העדכנית ביותר כבר מותקנת.",
        "ja": "最新バージョンをご利用中です。",
        "it": "Stai utilizzando l'ultima versione.",
        "id": "Anda menggunakan versi terbaru.",
        "uk": "Ви використовуєте найновішу версію.",
        "nl": "Je gebruikt de nieuwste versie.",
        "ca": "Estàs utilitzant la darrera versió.",
        "el": "Χρησιμοποιείτε την τελευταία έκδοση.",
        "sv": "Du använder den senaste versionen.",
        "es": "Estás usando la última versión.",
        "sk": "Používate najnovšiu verziu.",
        "sl": "Uporabljate najnovejšo različico.",
        "th": "คุณกำลังใช้เวอร์ชันล่าสุด",
        "cs": "Používáte nejnovější verzi.",
        "da": "Du bruger den nyeste version.",
        "de": "Du verwendest die neueste Version.",
        "tr": "En son sürümü kullanıyorsunuz.",
        "no": "Du bruker den nyeste versjonen.",
        "hu": "A legújabb verziót használod.",
        "hi": "आप नवीनतम संस्करण का उपयोग कर रहे हैं।",
        "fi": "Käytössäsi on uusin versio.",
        "fr": "Vous utilisez la dernière version.",
        "vi": "Bạn đang sử dụng phiên bản mới nhất.",
        "pl": "Używasz najnowszej wersji.",
        "pt": "Você está usando a versão mais recente.",
        "ro": "Folosiți cea mai recentă versiune.",
        "ru": "Вы используете последнюю версию.",
        "ko": "최신 버전을 사용 중입니다.",
        "zh-Hans": "您使用的是最新版本。",
        "zh-Hant": "您使用的是最新版本。"
    },
    "status.unsupportedOs": {
        "en": "This update requires a newer OS version.",
        "ar": "يتطلب هذا التحديث إصدارًا أحدث من نظام التشغيل.",
        "he": "עדכון זה דורש גרסה חדשה יותר של מערכת ההפעלה.",
        "ja": "このアップデートには新しいOSバージョンが必要です。",
        "it": "Questo aggiornamento richiede una versione del sistema operativo più recente.",
        "id": "Pembaruan ini memerlukan versi OS yang lebih baru.",
        "uk": "Для цього оновлення потрібна новіша версія ОС.",
        "nl": "Deze update vereist een nieuwere OS-versie.",
        "ca": "Aquesta actualització requereix una versió de SO més recent.",
        "el": "Aυτή η ενημέρωση απαιτεί νεότερη έκδοση λειτουργικού συστήματος.",
        "sv": "Den här uppdateringen kräver en nyare OS-version.",
        "es": "Esta actualización requiere una versión de SO más reciente.",
        "sk": "Táto aktualizácia vyžaduje novšiu verziu OS.",
        "sl": "Ta posodobitev zahteva novejšo različico operacijskega sistema.",
        "th": "อัปเดตนี้ต้องใช้ OS เวอร์ชันที่ใหม่กว่า",
        "cs": "Tato aktualizace vyžaduje novější verzi OS.",
        "da": "Denne opdatering kræver en nyere OS-version.",
        "de": "Dieses Update erfordert eine neuere Betriebssystemversion.",
        "tr": "Bu güncelleme daha yeni bir işletim sistemi sürümü gerektirir.",
        "no": "Denne oppdateringen krever en nyere OS-versjon.",
        "hu": "Ehhez a frissítéshez újabb OS-verzió szükséges.",
        "hi": "इस अपडेट के लिए नए ओएस संस्करण की आवश्यकता है।",
        "fi": "Tämä päivitys vaatii uudemman käyttöjärjestelmäversion.",
        "fr": "Cette mise à jour nécessite une version plus récente du système d'exploitation.",
        "vi": "Bản cập nhật này yêu cầu phiên bản OS mới hơn.",
        "pl": "Ta aktualizacja wymaga nowszej wersji systemu operacyjnego.",
        "pt": "Esta atualização requer uma versão mais recente do sistema operacional.",
        "ro": "Această actualizare necesită o versiune mai nouă a sistemului de operare.",
        "ru": "Для этого обновления требуется более новая версия ОС.",
        "ko": "이 업데이트를 하려면 더 높은 OS 버전이 필요합니다.",
        "zh-Hans": "此更新需要更高的操作系统版本。",
        "zh-Hant": "此更新需要更高的作業系統版本。"
    },
    "status.missingDestination": {
        "en": "This update is temporarily unavailable.",
        "ar": "هذا التحديث غير متاح مؤقتًا.",
        "he": "עדכון זה אינו זמין באופן זמני.",
        "ja": "このアップデートは一時的に利用できません。",
        "it": "Questo aggiornamento è temporaneamente non disponibile.",
        "id": "Pembaruan ini tidak tersedia untuk sementara waktu.",
        "uk": "Це оновлення тимчасово недоступне.",
        "nl": "Deze update is tijdelijk niet beschikbaar.",
        "ca": "Aquesta actualització no està disponible temporalment.",
        "el": "Aυτή η ενημέρωση είναι προσωρινά μη διαθέσιμη.",
        "sv": "Den här uppdateringen är tillfälligt inte tillgänglig.",
        "es": "Esta actualización no está disponible temporalmente.",
        "sk": "Táto aktualizácia je dočasne nedostupná.",
        "sl": "Ta posodobitev je začasno ni na voljo.",
        "th": "อัปเดตนี้ยังไม่พร้อมใช้งานชั่วคราว",
        "cs": "Tato aktualizace je dočasně nedostupná.",
        "da": "Denne opdatering er midlertidigt utilgængelig.",
        "de": "Dieses Update ist vorübergehend nicht verfügbar.",
        "tr": "Bu güncelleme geçici olarak mevcut değil.",
        "no": "Denne oppdateringen er midlertidig utilgjengelig.",
        "hu": "Ez a frissítés átmenetileg nem érhető el.",
        "hi": "यह अपडेट अस्थायी रूप से उपलब्ध नहीं है।",
        "fi": "Tämä päivitys ei ole tilapäisesti saatavilla.",
        "fr": "Cette mise à jour est temporairement indisponible.",
        "vi": "Bản cập nhật này tạm thời không khả dụng.",
        "pl": "Ta aktualizacja jest tymczasowo niedostępna.",
        "pt": "Esta atualização está temporariamente indisponível.",
        "ro": "Această actualizare este temporar indisponibilă.",
        "ru": "Это обновление временно недоступно.",
        "ko": "이 업데이트는 일시적으로 사용할 수 없습니다.",
        "zh-Hans": "此更新暂时无法使用。",
        "zh-Hant": "此更新暫時無法使用。"
    },
    "status.unavailable": {
        "en": "This update page is currently unavailable.",
        "ar": "صفحة التحديث هذه غير متاحة حاليًا.",
        "he": "דף העדכון אינו זמין כעת.",
        "ja": "このアップデートページは現在利用できません。",
        "it": "Questa pagina di aggiornamento non è al momento disponibile.",
        "id": "Halaman pembaruan ini saat ini tidak tersedia.",
        "uk": "Ця сторінка оновлення наразі недоступна.",
        "nl": "Deze updatepagina is momenteel niet beschikbaar.",
        "ca": "Aquesta pàgina d'actualització no està disponible actualment.",
        "el": "Aυτή η σελίδα ενημέρωσης δεν είναι διαθέσιμη αυτήν τη στιγμή.",
        "sv": "Den här uppdateringssidan är inte tillgänglig för närvarande.",
        "es": "Esta página de actualización no está disponible en este momento.",
        "sk": "Táto stránka aktualizácie je momentálne nedostupná.",
        "sl": "Ta stran za posodobitev trenutno ni na voljo.",
        "th": "หน้าอัปเดตนี้ยังไม่พร้อมใช้งานในขณะนี้",
        "cs": "Tato stránka aktualizace je momentálně nedostupná.",
        "da": "Denne opdateringsside er i øjeblikket ikke tilgængelig.",
        "de": "Diese Update-Seite ist derzeit nicht verfügbar.",
        "tr": "Bu güncelleme sayfası şu anda mevcut değil.",
        "no": "Denne oppdateringssiden er for øyeblikket ikke tilgjengelig.",
        "hu": "Ez a frissítési oldal jelenleg nem érhető el.",
        "hi": "यह अपडेट पेज वर्तमान में उपलब्ध नहीं है।",
        "fi": "Tämä päivityssivu ei ole tällä hetkellä saatavilla.",
        "fr": "Cette page de mise à jour n'est pas disponible pour le moment.",
        "vi": "Trang cập nhật này hiện không khả dụng.",
        "pl": "Ta strona aktualizacji jest obecnie niedostępna.",
        "pt": "Esta página de atualização não está disponível no momento.",
        "ro": "Această pagină de actualizare nu este disponibilă momentan.",
        "ru": "Эта страница обновления в настоящее время недоступна.",
        "ko": "현재 이 업데이트 페이지를 사용할 수 없습니다.",
        "zh-Hans": "当前无法使用此更新页面。",
        "zh-Hant": "目前無法使用此更新頁面。"
    },
    "button.update": {
        "en": "Update and play the event",
        "ar": "حدّث والعب الفعالية",
        "he": "עדכנו ושחקו באירוע",
        "ja": "更新してイベントを遊ぶ",
        "it": "Aggiorna e gioca all'evento",
        "id": "Perbarui dan mainkan acara",
        "uk": "Оновіть і грайте в подію",
        "nl": "Update en speel het evenement",